{
  "$orqui": {
    "schema": "layout-contract",
    "version": "2.0.0",
    "hash": "sha256:pending",
    "generatedAt": "2026-02-02T22:00:00Z"
  },

  "app": {
    "name": "Gatekeeper",
    "favicon": {
      "type": "emoji",
      "value": "ðŸ›¡ï¸"
    },
    "logo": {
      "type": "icon-text",
      "text": ".Gatekeeper",
      "icon": "ShieldCheck",
      "font": {
        "family": "JetBrains Mono",
        "size": 16,
        "weight": 700,
        "color": "$tokens.colors.accent"
      }
    }
  },

  "tokens": {
    "spacing": {
      "2xs": { "value": 2, "unit": "px" },
      "xs": { "value": 4, "unit": "px" },
      "sm": { "value": 8, "unit": "px" },
      "md": { "value": 16, "unit": "px" },
      "lg": { "value": 24, "unit": "px" },
      "xl": { "value": 32, "unit": "px" },
      "2xl": { "value": 48, "unit": "px" },
      "3xl": { "value": 64, "unit": "px" }
    },
    "sizing": {
      "sidebar-width": { "value": 260, "unit": "px" },
      "sidebar-collapsed": { "value": 64, "unit": "px" },
      "header-height": { "value": 56, "unit": "px" },
      "content-max-width": { "value": 1200, "unit": "px" },
      "icon-sm": { "value": 16, "unit": "px" },
      "icon-md": { "value": 20, "unit": "px" },
      "icon-lg": { "value": 24, "unit": "px" }
    },
    "colors": {
      "bg": { "value": "#0a0a0b" },
      "surface": { "value": "#141417" },
      "surface-2": { "value": "#1c1c21" },
      "surface-3": { "value": "#24242b" },
      "border": { "value": "#2a2a33" },
      "border-2": { "value": "#3a3a45" },
      "text": { "value": "#e4e4e7" },
      "text-muted": { "value": "#8b8b96" },
      "text-dim": { "value": "#5b5b66" },
      "accent": { "value": "#6d9cff" },
      "accent-dim": { "value": "#4a7adf" },
      "danger": { "value": "#ff6b6b" },
      "success": { "value": "#4ade80" },
      "warning": { "value": "#fbbf24" },
      "sidebar-bg": { "value": "#111114" },
      "header-bg": { "value": "#0a0a0b" }
    },
    "fontFamilies": {
      "primary": { "value": "Inter, -apple-system, sans-serif" },
      "display": { "value": "Inter, -apple-system, sans-serif" },
      "mono": { "value": "JetBrains Mono, Fira Code, monospace" }
    },
    "fontSizes": {
      "xs": { "value": 11, "unit": "px" },
      "sm": { "value": 13, "unit": "px" },
      "md": { "value": 14, "unit": "px" },
      "lg": { "value": 16, "unit": "px" },
      "xl": { "value": 18, "unit": "px" },
      "2xl": { "value": 24, "unit": "px" },
      "3xl": { "value": 30, "unit": "px" }
    },
    "fontWeights": {
      "regular": { "value": 400 },
      "medium": { "value": 500 },
      "semibold": { "value": 600 },
      "bold": { "value": 700 }
    },
    "borderRadius": {
      "sm": { "value": 4, "unit": "px" },
      "md": { "value": 6, "unit": "px" },
      "lg": { "value": 8, "unit": "px" },
      "xl": { "value": 12, "unit": "px" },
      "full": { "value": 9999, "unit": "px" }
    },
    "borderWidth": {
      "thin": { "value": 1, "unit": "px" },
      "medium": { "value": 2, "unit": "px" }
    }
  },

  "textStyles": {
    "heading-1": {
      "fontFamily": "$tokens.fontFamilies.display",
      "fontSize": "$tokens.fontSizes.3xl",
      "fontWeight": "$tokens.fontWeights.bold",
      "lineHeight": 1.2
    },
    "heading-2": {
      "fontFamily": "$tokens.fontFamilies.display",
      "fontSize": "$tokens.fontSizes.2xl",
      "fontWeight": "$tokens.fontWeights.semibold",
      "lineHeight": 1.3
    },
    "heading-3": {
      "fontFamily": "$tokens.fontFamilies.display",
      "fontSize": "$tokens.fontSizes.lg",
      "fontWeight": "$tokens.fontWeights.semibold",
      "lineHeight": 1.4
    },
    "body": {
      "fontFamily": "$tokens.fontFamilies.primary",
      "fontSize": "$tokens.fontSizes.md",
      "fontWeight": "$tokens.fontWeights.regular",
      "lineHeight": 1.5
    },
    "body-sm": {
      "fontFamily": "$tokens.fontFamilies.primary",
      "fontSize": "$tokens.fontSizes.sm",
      "fontWeight": "$tokens.fontWeights.regular",
      "lineHeight": 1.5
    },
    "caption": {
      "fontFamily": "$tokens.fontFamilies.primary",
      "fontSize": "$tokens.fontSizes.xs",
      "fontWeight": "$tokens.fontWeights.medium",
      "lineHeight": 1.4
    },
    "code": {
      "fontFamily": "$tokens.fontFamilies.mono",
      "fontSize": "$tokens.fontSizes.sm",
      "fontWeight": "$tokens.fontWeights.regular",
      "lineHeight": 1.6
    },
    "nav-item": {
      "fontFamily": "$tokens.fontFamilies.primary",
      "fontSize": "$tokens.fontSizes.sm",
      "fontWeight": "$tokens.fontWeights.medium",
      "lineHeight": 1.4
    }
  },

  "shell": {
    "layout": "sidebar-left",

    "sidebar": {
      "width": 260,
      "collapsedWidth": 64,
      "collapsible": true,
      "background": "$tokens.colors.sidebar-bg",
      "sections": [
        { "id": "logo", "type": "logo" },
        { "id": "nav", "type": "navigation" },
        { "id": "footer", "type": "slot", "props": { "name": "sidebar-footer" } }
      ],
      "separators": {
        "afterLogo": { "enabled": true, "color": "$tokens.colors.border", "style": "solid" },
        "beforeFooter": { "enabled": true, "color": "$tokens.colors.border", "style": "solid" }
      },
      "collapseButton": {
        "position": "border-center",
        "icon": "chevron"
      }
    },

    "header": {
      "height": 56,
      "background": "$tokens.colors.header-bg",
      "border": { "bottom": { "enabled": true, "color": "$tokens.colors.border" } },
      "left": [
        {
          "id": "breadcrumbs",
          "type": "breadcrumbs",
          "props": {
            "separator": "/",
            "showHome": true,
            "homeLabel": "Home",
            "homeRoute": "/"
          }
        }
      ],
      "center": [],
      "right": [
        {
          "id": "header-search",
          "type": "search",
          "props": { "placeholder": "Buscar... (âŒ˜K)" }
        },
        {
          "id": "icon-notifications",
          "type": "icon-button",
          "props": { "icon": "Bell", "route": "/notifications", "badge": "{{stats.pending_runs}}" },
          "visibility": { "condition": "{{stats.pending_runs}} > 0" }
        },
        {
          "id": "cta-main",
          "type": "button",
          "props": {
            "label": "Nova ValidaÃ§Ã£o",
            "variant": "primary",
            "icon": "Plus",
            "route": "/runs/new"
          }
        }
      ]
    },

    "footer": {
      "enabled": false
    }
  },

  "navigation": [
    { "id": "dashboard", "label": "Dashboard", "icon": "House", "route": "/", "order": 0 },
    { "id": "runs", "label": "Runs", "icon": "Play", "route": "/runs", "order": 1, "badge": "{{stats.pending_runs}}" },
    { "id": "gates", "label": "Gates", "icon": "FunnelSimple", "route": "/gates", "order": 2 },
    { "id": "divider-1", "type": "divider", "order": 3 },
    { "id": "workspaces", "label": "Workspaces", "icon": "Folder", "route": "/workspaces", "order": 4 },
    { "id": "projects", "label": "Projects", "icon": "Code", "route": "/projects", "order": 5 },
    { "id": "divider-2", "type": "divider", "order": 6 },
    { "id": "mcp", "label": "MCP", "icon": "Terminal", "route": "/mcp", "order": 7, "visibility": { "condition": "{{feature.mcp_enabled}}" } },
    { "id": "config", "label": "Config", "icon": "Gear", "route": "/config", "order": 8, "position": "bottom" }
  ],

  "pages": {

    "dashboard": {
      "id": "dashboard",
      "label": "Dashboard",
      "route": "/",
      "browserTitle": "Dashboard â€” {{$app.name}}",
      "header": {
        "cta": { "enabled": true, "label": "Nova ValidaÃ§Ã£o", "route": "/runs/new" }
      },
      "content": {
        "id": "dashboard-root",
        "type": "stack",
        "props": { "gap": "$tokens.spacing.lg" },
        "children": [
          {
            "id": "page-title",
            "type": "heading",
            "props": { "content": "Dashboard", "level": 1, "textStyle": "heading-1" }
          },
          {
            "id": "stats-grid",
            "type": "grid",
            "props": { "columns": 4, "gap": "$tokens.spacing.md" },
            "children": [
              {
                "id": "stat-total",
                "type": "stat-card",
                "props": {
                  "label": "Total Runs",
                  "value": "{{stats.total_runs}}",
                  "icon": "Play"
                }
              },
              {
                "id": "stat-passed",
                "type": "stat-card",
                "props": {
                  "label": "Aprovadas",
                  "value": "{{stats.passed_runs}}",
                  "icon": "CheckCircle",
                  "color": "success"
                }
              },
              {
                "id": "stat-failed",
                "type": "stat-card",
                "props": {
                  "label": "Falharam",
                  "value": "{{stats.failed_runs}}",
                  "icon": "XCircle",
                  "color": "danger"
                }
              },
              {
                "id": "stat-rate",
                "type": "stat-card",
                "props": {
                  "label": "Taxa de AprovaÃ§Ã£o",
                  "value": "{{stats.pass_rate | percent}}",
                  "icon": "ChartLineUp",
                  "color": "accent"
                }
              }
            ]
          },
          {
            "id": "content-grid",
            "type": "grid",
            "props": { "columns": 3, "gap": "$tokens.spacing.lg" },
            "children": [
              {
                "id": "recent-runs-card",
                "type": "card",
                "props": { "title": "Runs Recentes", "span": 2 },
                "children": [
                  {
                    "id": "recent-runs-table",
                    "type": "table",
                    "props": {
                      "dataSource": "recent_runs",